masked,original
그러니까 일이 아니라 그냥 얘가이라 못한,그러니까 어려운 일이 아니라 그냥 얘가 처음이라 못한 거겠지
그색이 더 잘 것 같은데?,그 옆에 핑크색이 더 잘 어울릴 것 같은데?
층간소음으로 살인,층간소음으로 살인났다며?
죽은 착했다고,죽은 피해자 되게 착했다고 하던데
##한 여자가 더 좋,나는 통통한 여자가 더 좋더라
통통 여자가?,통통한 여자가 왜 좋은데?
##지?,이번에 여행 다녀왔지?
##가 했었냐?,걔가 뭐라고 했었냐?
칼둥이,칼둥이가 뭐야?
다들 졸업은 거지,다들 졸업은 어떻게 하는 거지?
##통 때문에 배 아파 죽겠다 진짜 싫음,생리통 때문에 배 아파 죽겠다 진짜 생리하기 싫음
와통 안 겪어봐서 모르면서 함부로 말하지 등 허리 다,와 생리통 안 겪어봐서 모르면서 함부로 말하지마라 등 허리 다 아프다
가톨릭 배아도라서 이식 않은 배아는 낙태한걸로 보는거 몰라?,가톨릭에선 배아도 생명이라서 이식하지 않은 배아는 낙태한걸로 보는거 몰라?
하고따하네,감사합니다 하고 번호따야하네
남자한테 인기 많은 게이니?,내가 남자한테 인기 많은 게 내 탓이니?
##지냐?,몸이 도화지냐?
##라고 낳은 자식이,그러라고 낳은 자식이 아닐텐데ㅠㅠ
동상 걸리는 그게 낫지 않을까?,밖에서 동상 걸리는 것보다는 그게 낫지 않을까?
[UNK] 편함? 그거 왜 쓰는 거임? 솔직히 이해 아나 그냥 사치품,[UNK] 편함? 그거 왜 쓰는 거임? 나 솔직히 이해 아나던데 그냥 사치품 같음
같이 봐준 오피스텔하기로 했니?,내가 같이 알아 봐준 오피스텔 계약하기로 했니?
,너 정말 답답하다
그러게 집은 밀폐공간이니 줄이고 성니 늘려야지 이게 상식아닌가,그러게 집은 밀폐공간이니 줄이고 성묘는 야외니 늘려야지 이게 상식아닌가
능력 없는,능력 없는 것도 죄냐?
삐쩍 말랐는데 엄 쌘 운동 선수애들은 대체 ;,삐쩍 말랐는데 힘 엄첨 쌘 운동 선수애들은 대체 뭐야;
,ㅠㅠ
완전 타보고 싶다ㅜㅜ 나도 거기서 존잘과 하고싶어 완전 [UNK],[UNK] 완전 타보고 싶다ㅜㅜ 나도 거기서 [UNK] 존잘과 친구 하고싶어 완전 [UNK]
##것들은 친구들이랑 부모 월급 물어대,요즘 어린것들은 친구들이랑 부모 월급 물어본대
##맘들이 어쨌길래 그래,캣맘들이 뭘 어쨌길래 그래?
##맘들이 또 고양이들한테 밥더라고,캣맘들이 또 고양이들한테 밥줬더라고.
##들이함을 하니까 그렇지.,이용자들이 불편함을 느끼게 하니까 그렇지.
##으면 좀하는 모습도 보여야지.,그래도 해줬으면 좀 고마워하는 모습도 보여야지.
아 그런가? 지능었네,아 그런가? 지능적인 정치인이었네
##를 것도 아닌데 뭐 어때.,내가 치마를 입은 것도 아닌데 뭐 어때.
그래도 그렇게 다리를 벌리고으면 다른 사람들이하지.,그래도 그렇게 다리를 쩍 벌리고 앉으면 다른 사람들이 민망하지.
##들을 다보요...,악플들을 다 읽어보았는데요...
##이네,여기 성비 최악이네
##하고한데 식당은 아니다,나는 조용하고 아늑한데 식당은 아니다
##하고하고 영,메뉴하고 식당하고 영 반대다
헛소리말고 나가 여긴 아니다,헛소리말고 나가자 여긴 아니다.
[UNK] 는공격수가 아니 포인터지,[UNK]는 빠른공격수가 아니잔아 포인터 공격수지
누가머느리다고 황의찬이를 전방에게낫지,누가머래 너무느리다고 황의찬이를 전방에 두는게낫지
니가 축구를 아나 전방 골결정력좋은 [UNK] 가,니가 축구를 아나마 전방은 골결정력좋은 [UNK]가 맞아
##든 지거나면 [UNK] 는 짜르겟지,어째든 이번에 지거나 비기면 [UNK]는 짜르겟지
흥민이 너무시키는 맘에안들어,흥민이 너무 혹사시키는것도 맘에안들어
아이을 만들어줘야 해서 고급원에 가야한. ㅋㅋㅋㅋ,아이 인맥을 만들어줘야 해서 고급 조리원에 가야한댄다. ㅋㅋㅋㅋ
##가 안되나보네,욕구 해소가 안되나보네
남이 덧니가 있든 없든 그게 너랑,남이 덧니가 있든 없든 그게 너랑 무슨 상관인데
너 친 넌 꼬이는거야,쟤가 너 친자로 밝혀지면 넌 꼬이는거야
##야지?,둘째는 낳아야지?
조선족이냐,조선족이 동포냐
##같은,동포같은 소리하고 있네
대구에 기관총호원 데리고 가서 잘하고 있냐고 거랑 같네,대구에 기관총경호원 데리고 가서 국정 잘하고 있냐고 묻는 거랑 같네
ㅋㅋㅋ에 사람 거어??,ㅋㅋㅋ 이태원에 사람 모인 거 봤어??
증거고만 방구야,증거 다 나왔고만 말이야 방구야
아니 이도 여자 잔뜩 불러서 노는 사람들이,아니 이 시국에도 여자 잔뜩 불러서 노는 사람들이 있어?
뭐 다 돈 아저씨,뭐 다 돈 많은 아저씨들이지 뭐
##중간하게 잘 게 제일 것 같아.,어중간하게 잘 사는 게 제일 힘든 것 같아.
##지,그것도 능력이지
쩝쩝대면서까?,왜 저렇게 쩝쩝대면서 먹을까?
나 10 다먹을수 있어,나 10초만에 짜장면 다먹을수 있어
그냥 부모님 돈이나 야금야금 먹으면서 살고,나는 그냥 부모님 돈이나 야금야금 먹으면서 살고 싶어.
##까,나도 키울까?
맞아 죽는 여자가 정신 좀.,맞아 죽는 여자가 얼마나 많은데 정신 좀 차려라.
드디어 모쏠!,나도 드디어 모쏠 탈출했다!
##도 해봤잖아.,어제 첫 키스도 해봤잖아.
[UNK] 시체 가져와 선동하는건지,[UNK] 시체 가져와서 왜 선동하는건지 모르겠다
남친이 배에 줄있다고 언제 임신했냐고 저를 사람 취급,어느날 남친이 배에 줄있다고 언제 임신했냐고 저를 이상한 사람 취급해요
##하셈ㅇㅇ,너가 이해하셈ㅇㅇ
파트너 지낼 듯,그래서 앞으로 파트너로 지낼 듯
아 [UNK],아 [UNK] 먹고 싶다
맞아 스트레스 받을때 직이야,맞아 스트레스 받을때 먹으면 직빵이야
##치고 화장이서 그럴껄?,남자치고 화장이 진해서 그럴껄?
너는 버리스트 그런거? 그냥 해보고?,너는 버킷리스트 그런거 없어? 그냥 해보고 싶은거?
##었는데 돌아오는게 거니?,진짜 믿었는데 돌아오는게 그런 거니?
이 사람 다한 심하,이 사람 다한증 되게 심하대
여기서도 성추행 수준 떨어진다,여기서도 성추행 댓글 수준 떨어진다
요즘 세상에 어디 개천에서 말이지,요즘 세상에 어디 개천에서 용이 나야 말이지.
자전거 타는 여자 뒤 보니까 달고 타던데 그렇게 흐르더라 생수인가?,자전거 타는 여자 뒤 보니까 진동기구 달고 타던데 물이 그렇게 흐르더라  생수인가 ?
진동기구는 그렇다 쳐도 성수 하는거보니까 개웃기네ㅋ 저렇게을 가질수도 있구나,진동기구는 그렇다 쳐도 성수라고 하는거보니까 개웃기네 ㅋㅋㅋ 저렇게 발상을 가질수도 있구나
##라도 불륜 미화,아무리 드라마라도 불륜 미화하지마
대구에서 바람다 걸려서 여자한 거?,대구에서 바람피다 걸려서 여자 투신한 거 봄?
나이차로 욕 [UNK] 도랑 막내랑살 차이 아니냐?,나이차로 욕하기엔 [UNK]도 리더랑 막내랑 8살 차이 아니냐?
왜구만,왜 잘생겼구만
##셨어요. 어머니? 미리지,오셨어요. 어머니? 미리 연락주시지
##가 비었네,냉장고가 텅 비었네
남편한테줘라 늙어서되지으려면,남편한테 잘해줘라 늙어서 혼자되지 않으려면
존중 받으려면 아들부터 좀 챙겨 먹여,존중 받으려면 내 아들부터 밥 좀 잘 챙겨 먹여
##살도 안됐 무슨 문신을 그렇게 하는지,아직 20살도 안됐는데 무슨 문신을 그렇게 하는지
엥 la 갈비 전라도임? 로스엔젤레스 아님?,엥 la 갈비가 왜 전라도 음식임? 로스엔젤레스 아님?
"와, 나 진짜 싶","와, 나 진짜 [UNK] 오고 싶었어"
"야, 나 하던 전남이 내 현남 보자마자 도망감 ㅋㅋ","야, 나 스토킹 하던 전남친이 내 현남친 보자마자 도망감 ㅋㅋ"
,추미애가 옳았다
,동감
어 저인 여기서 사회 나오네?,어 저 남자연예인 여기서 사회자로 나오네?
,애니 재밌다
남자 하면 바로 끊,남자인척 하면 바로 연락 끊더라
김치,야 김치 없어?
아니 너가 남자도 아니고 오빠도 아니고 대체 왜을 하는거야,아니 너가 내 남자친구도 아니고 오빠도 아니고 대체 왜 간섭을 하는거야
##고 싶어서,널 지켜주고 싶어서 그래
##걸 몸이 엄청진데,딴걸 몰라도 몸이 엄청 망가진데
가난한 좀 패 좋겠다,가난한 사람 좀 그만 패면 좋겠다
##해도 애 낳을 수도,가난해도 애 낳을 수도 있지 ㅜㅜ
전라도에서 절도?,전라도에서 절도 사건이 있었다며?
##뿐 아니라 살인까지 발생,절도뿐 아니라 살인까지 발생했대
##서도 할 수 있어,왜 지방에서도 충분히 할 수 있어
##하네,뭐 몸매 좋긴하네
쓰레기도 안다니.,자기 먹은 쓰레기도 안 치우다니.
그래서 집에젝터했냐,그래서 집에 빔프로젝터 설치했냐
이게 교사라는 한래,이게 어린이집 교사라는 사람이 한 소리래
가슴쪽이 욱,가슴쪽이 살짝 욱신거리네
진짜 그 케릭터 너무 얄밉게 연기,진짜 그 케릭터 너무 얄밉게 연기 잘했더라.
응가 너무서 인기가 장난 아냐,"응, 셀카가 너무 예뻐서 인기가 장난 아냐"
가끔은 진짜 불법적인 일을 하는 돈을 더 많이 벌,가끔은 진짜 불법적인 일을 하는 사람들이 돈을 더 많이 벌더라.
선조 있잖아.,선조의 지혜가 있잖아.
[UNK]년 떴네,[UNK] 42년형 떴네
##년.. 느껴진다,42년.. 뭔가 짧게 느껴진다
[UNK] 같은 사람들은 엄청 주고 엄청주는 남자 만나면 확 좋아져요.,[UNK]같은 사람들은 엄청엄청 믿음 주고 엄청 사랑해주는 남자 만나면 확 좋아져요.
너무 당연하다는 듯이 말하는 게이다되네요,너무 당연하다는 듯이 말하는 게 참 이기적이다 생각되네요
정말 사람 만나 되어지고 싶으면요,정말 좋은 사람 만나 건강한 관계가 되어지고 싶으면요
자신의 문제를하고 인정해 스스로가 먼저사람이 되세요,자신의 문제를 마주하고 인정해서 스스로가 먼저 좋은사람이 되세요
자살한 거 진짜 않냐,서울 시장 자살한 거 진짜 웃기지 않냐
진짜감이라곤 1도,진짜 위협감이라곤 1도 없다
##라이으로 사니까 매일매일이 긴장되고 기분 좋아지는 거 같다,요즘 사무라이정신으로 사니까 매일매일이 긴장되고 기분 좋아지는 거 같다
그런 모욕마저는 것이 바로라이 정신이지,그런 모욕마저 참고 견디는 것이 바로 사무라이 정신이지
"사람 거 싫고, 서서 수도 있으니까. 다리잖아","사람 많은 거 싫고, 서서 갈 수도 있으니까. 다리 아프잖아"
##했다고 그러냐?,얘가 자숙했다고 누가 그러냐?
자숙은 무슨 그냥 거지.,자숙은 무슨 그냥 잠적한 거지.
이걸 사람이라고 시험,이걸 사람이 풀라고 낸 시험인가
프로 좀비 밖에 없노,티비 프로 좀비 예능 밖에 없노
##치 당했다,새치 당했다면서?
다음엔 누굴지 잘까?,다음엔 누굴 뽑아지 잘 해줄까?
##알도 없는 거 왜 끼고 다님?,안경알도 없는 거 왜 끼고 다님?
"나는 남자랑 좀 더 진도를 나가고 싶은데, 방법을 몰라서이야","나는 남자친구랑 좀 더 진도를 나가고 싶은데, 방법을 몰라서 고민이야."
까진,그정도 까진..
오빠 저 [UNK],안녕 오빠 저 [UNK]에요.
야만이니,야 이게 몇년만이니?
니가어 미치는 알았어,니가 보고싶어 미치는줄 알았어.
넌머리가 없냐,넌 왜 이렇게 인정머리가 없냐
저 방송은가 넘,저 방송은 한지 2주가 넘었네
안고 해도 반찬,안 먹는다고 해도 맨날 반찬 보낸다
야만줘라,야 나 백만원만 빌려줘라
,일하기 싫다
##도 하고 얼굴도 예쁘고...,[UNK] 노래도 잘 하고 얼굴도 예쁘고...
아 그 나이에 돈 거 솔직히긴 하다 자괴감 오네,아 그 나이에 그 돈 버는 거 솔직히 부럽긴 하다 자괴감 오네
혹시 장래희망이?,넌 혹시 장래희망이 뭐야?
##망은 의사야.,내 장래희망은 의사야.
,안타깝다ㅋㅋ
쿠키라더니 알고 보니 방부제 쿠키,유기농 쿠키라더니 알고 보니 방부제 쿠키였대
##련가,진짜 그러련가?
##박이야? 안들어가?,오늘도 외박이야? 집에 안들어가?
,옳다!!
낙태해야해,낙태는 전면 찬성해야해
##지?,곱창 맛있지 않냐?
##서 끼,답답해서 못 끼겠어요
##서하는거지?,너보다 이뻐서 질투하는거지?
돈 게라는 생각은 들어..,돈 보는 게 잘못이라는 생각은 안 들어..
그래 너 살고 살면 거지 ~,그래 너 살고 싶은 대로 살면 되는 거지~
,ㅋㅋ 고맙다!
게 못하는,안하는 게 아니라 못하는 거겠지
##해서 돈 받고 입양시킨다는 봄?,냥줍해서 돈 받고 입양시킨다는 글 봄?
"임용고시 또어, 부모님한테 미안해서 어떻게 얼굴?","이번에 임용고시 또 떨어졌어, 부모님한테 미안해서 어떻게 얼굴 봐?"
낮에 카페가면 애딸 아줌마밖에임?,낮에 카페가면 왜 애딸린 아줌마밖에 없는거임?
[UNK] 3가,[UNK]는 3까지가 좋았다
어머니가면시겠어,어머니가 아시면 얼마나 슬프시겠어
헉.. ㅋㅋ그래도 심한 거 한번 잘야지,헉..ㅋㅋ그래도 그건 심한 거 같은데 한번 잘 말해봐야지
,난 걍 만나
접대 예약할까요?,고객 접대는 어디로 예약할까요?
키 큰 알아서 관심까 과묵 거 같네,키 큰 애들은 알아서 관심 받으니까 과묵한 거 같네
일본 물에 잠기고 진가?,일본 점점 물에 잠기고 있다는데 진짠가?
##들 사지 입양하자,강아지들 사지말고 입양하자
아주 나이네겠다,아주 나쁨이네 조심해야겠다
누구의 자자는게,누구의 자잘못을 따지자는게 아니야
그 친구는을 때부터 가난하게 자라서었.,그 친구는 어렸을 때부터 가난하게 자라서 힘들었대.
##하게 키워주신 부모님께하다는 생각이 들더라.,날 풍족하게 키워주신 부모님께 감사하다는 생각이 들더라.
너 같은에 그렇게 생겨서 어떡해?,너 같은 사무실에 그렇게 불편한 사람이 생겨서 어떡해?
오늘 진짜 살인,와 오늘 날씨 진짜 살인적이다
남자는 시간만 나면 베트남으로 가.,그 남자는 시간만 나면 베트남으로 여행을 가더라고.
헬조선 헬조선거리 코로나는 국뽕 국뽕거림,언제는 헬조선 헬조선거리더니 코로나 이후에는 국뽕 국뽕거림
너네집 가훈이,너네집 가훈이 뭐야?
,부럽냐?
,오늘 뭐해?
생각이 없어.,난 너랑 놀 생각이 없어.
##게도 공부는 쟤가이래,그런데 놀랍게도 공부는 쟤가 1등이래
넌이 그거 밖에,넌 옷이 그거 밖에 없어?
이 옷 것,이 옷이 많은 것 뿐이야
자살을,군대에서 왜 자살을 하니
##려 노인들에게 확대해도 되겠어,출산장려정책을 노인들에게 확대해도 되겠어
무슨 엄마를한다고 그러냐?,내가 무슨 우리 엄마를 학대한다고 그러냐?
일진 틱톡 무조건?,요즘 일진들은 틱톡 무조건 한다며?
바다 갔을 때 사진 찍 패디큐 칠!,바다 갔을 때 사진 찍으려고 패디큐어도 칠했어!
"##더니 더 강조되네,이 더 예쁘겠다.","그림 그렸더니 더 강조되네, 닭발이 더 예쁘겠다."
그러는 네은? 발이 어딨어.,그러는 네 발은? 세상에 예쁜 발이 어딨어.
##야날 소릴하고 있어,그거 범죄야 큰일날 소릴하고 있어
들었어 저 신입 낙하산,들었어? 저 신입 낙하산이래
##지,그니까 완전 그래야지
##랑 해야지,결혼은 외국인이랑 해야지~
MB가 신뢰도가 얼마나 낮은인데 그걸 삼냐,MBTI가 신뢰도가 얼마나 낮은 검사인데 그걸 기준으로 삼냐
내 여친은 많이하고도 좋은데 왜 다낭성 있는지,내 여친은 운동 많이하고 몸매도 좋은데 왜 다낭성 있는지 모르겠음
모텔 전체에를 설치한 놈들이.,모텔 객실 전체에 카메라를 설치한 놈들이 있어.
연쇄살인범 [UNK] 에세이도다,연쇄살인범 [UNK] 옛날에 에세이도 썼다더라
"와, 저 연예인 진짜고스럽게 생겼다","와, 저 연예인 진짜 예쁘고 사랑스럽게 생겼다."
팀플하는데 후배 애들이 다 해줘 꿀빨,팀플하는데 후배 애들이 다 해줘서 꿀빨았다.
운동 팔이,운동 너무 해서 팔이 아파
##도 알.,심지어 외국인들도 알더라.
거기할 조심,거기 운전할 때 조심해
어이 어깨 쳤으면 하고 가야지,어이 어깨 쳤으면 사과를 하고 가야지
형 누나한테 존 쓰냐? 그냥 편하게 않음?,형 누나한테 존댓말 쓰냐? 그냥 편하게 말하지 않음?
##을 수가,도저히 끊을 수가 없어
,운동 갈꺼야
너는 여드름 이나 감춰,너는 여드름 자국 이나 좀 감춰.
##석은배려석인거 아냐?,임산부 배려석은 여성배려석인거 아냐?
,무슨 소리야?
테러 세계의,테러는 전 세계의 문제야
나랑자는?,나랑 싸우자는거야 지금?
##한 난민들 중에 여성은 없,이번에 도착한 난민들 중에 여성은 없데
##하면 300만도 탈 수 있지.,집 포기하면 300만 벌어도 탈 수 있지.
그리고 저런 거 다 개인 거.,그리고 저런 거 다 개인 돈으로 사는 거 아니야.
##으면 회사에서기도 해,매출 높으면 회사에서 사주기도 해
윽냄새가 나누,윽 그런냄새가 어디서 나누
##조차 못 넘기고 오글거린다 하는데 ㅋㅋ 대체 안 오거리는 건 뭐냐,이런 댓글조차 못 넘기고 오글거린다 하는데 ㅋㅋ 대체 안 오글거리는 건 뭐냐
사람이 유부남이,사랑하는 사람이 생겼는데 유부남이에요
##년 저가 씹어먹었지,2012년엔 저 노래가 씹어먹었지
##신을 이딴 찍..,베드신을 이딴 식으로 찍다니..
너네 누나가 할머니,너네 누나가 왜 할머니야
남자들는걸로 찡찡거려,남자들 왜 군대가는걸로 찡찡거려?
,그러니까 ㅋㅋ
금융 한 먹어볼?,금융치료 한 번 먹어볼래?
벗고,마스크 벗고싶다
어머니는이 3프로 않았냐?,우리 어머니는 지분이 3프로 있지 않았냐?
어쩌냐 기저질환 탓 우길 없어서,어쩌냐 기저질환 탓이라고 우길 수 없어서.
##는 명명백백 대일제국의 땅이지,다케시마는 명명백백 대일본제국의 땅이지
##되 사람은지 말랬잖아.,죄는 미워하되 사람은 미워하지 말랬잖아.
##할,내일 청소할 거야
##질 애들 이렇게 많음?,젓가락질 못하는 애들 왜 이렇게 많음?
##은 빡,남친은 빡치지.
진짜 저게 사람이 할인가,와 진짜 저게 사람이 할 짓인가?
##염 걸렸?,너 질염 걸렸어?
##염?,질염은 왜?
한번 맡든가,너가 한번 맡아보든가.
저 사람은 허리를 빼고 다녀,저 사람은 허리를 왜 저렇게 빼고 다녀?
##은 얼굴만 보고 있어도,연예인은 얼굴만 보고 있어도 재밌네
영혼 한번 성대,영혼 결혼식 한번 성대하네
한밖에 마셨는데 운전해도 괜찮지?,한 잔밖에 안 마셨는데 운전해도 괜찮지 않을까?
간할지도 몰라,그러다 간 다 상할지도 몰라
난 네가 워낙 주 적으니까 거지,난 네가 워낙 주량이 적으니까 걱정한 거지
##서했다며?,내가 이뻐서 결혼했다며?
맞춤법 모른다고 바퀴벌레는하지,맞춤법 모른다고 바퀴벌레는 너무하지 않냐?
예전에는 몰랐는데 은근 글래네요,예전에는 몰랐는데 은근 글래머네요
ㄹㅇ헥헥대다가겠다고 반 이상 남김,ㄹㅇㅋㅋ헥헥대다가 못먹겠다고 반 이상 남김.
소리야? 나는 적!,무슨 소리야? 나는 그런 적 없어!
그 사건은 여자가 허증이라서 거짓말?,그 사건은 여자가 허언증이라서 거짓말한거라는데?
남자문 낙태시킨 건 변함없는 사실이잖아,남자측 입장문 봐도 낙태시킨 건 변함없는 사실이잖아
##도 2주 동안이나줬다는데 뭐가 문제야,미역국도 2주 동안이나 끓여줬다는데 뭐가 문제야?
미역국이 뭐 대수라고. 남자?,미역국이 뭐 대수라고.. 왜 남자 편들어?
야라도 하냐 ; ;,야 팩트라도 말을 그렇게 하냐;;
##ㅋ 싶고 보험료는 내기 싫고 ~,ㅋㅋㅋ 돈은 아끼고 싶고 보험료는 내기 싫고~
##라도 국가의 위상이 오르는 거지.,저런 집이라도 있어야 국가의 위상이 오르는 거지.
너가 살진의 존재가 너한테 도움이 된다니까.,너가 살진 않아도 저런 집의 존재가 너한테 도움이 된다니까.
##파괴 플라스틱마,환경파괴되니까 플라스틱 쓰지마
남자애들이 다 인성이 안좋,나는 만난 남자애들이 다 인성이 안좋았어
어제 지나가는데 너무게 생겨서 머리 쓰다듬으려고 했는데 물렸어 너무 사납더라,어제 개가 지나가는데 너무 귀엽게 생겨서 머리 쓰다듬으려고 했는데 물렸어 ㅜ 너무 사납더라
##인 배출 사업 잘 안 된 것은 한 개인의 책임으로 수만은.,우주인 배출 사업 잘 안 된 것은 한 개인의 책임으로 돌릴 수만은 없어.
본인들이 못보다 못 사는 사람들이 많다는 걸 생각하든가,본인들이 못 받으면 본인보다 못 사는 사람들이 많다는 걸 생각하든가.
할머니가 나랑 엄청한거,할머니가 나랑 동생 엄청 차별한거 알지
##생들 1차 접종 우리는 왜 안되냐고,아르바이트생들도 1차 접종 했다는데 우리는 왜 안되냐고
그러고찐 같아,그러고 보니까 살찐 거 같아
붙잡혀서 핸드폰 바꾸라고 강매당,나 어제 붙잡혀서 핸드폰 바꾸라고 강매당했어
##든 여자 결혼은 하는게 아닌듯,남자든 여자든 결혼은 하는게 아닌듯
"개그맨 [UNK], [UNK] 뭐라는 애들 대장암 걸리면 좋겠다.","개그맨 [UNK], [UNK] 뭐라는 애들 대장암 걸리면 좋겠다고 했더라."
##이 좋,요즘은 클래식이 좋더라
왜 ㅡㅡ나도 벌레함 그게 자동 반응나옴,왜 ㅡㅡ나도 벌레 무서워함 그리고 그게 자동적으로 반응나옴
##는 출산율이 토이네,이번 경선에서는 출산율이 토픽이네
##해 그렇지 뭐 진짜성 없다 다들,매해 그렇지 뭐 근데 진짜 현실성 없다 다들
솔직히 범죄자들 간다고 진짜 지,솔직히 범죄자들 감옥 간다고 진짜 반성하는 지 모르겠다
너가 사람이라서주는 거?,너가 좋은 사람이라서 잘해주는 거 아닐까?
##는 다 해왔겠지?,오늘 과제는 진짜로 다 해왔겠지?
##리가 기안했을겁니다,아마 이대리가 기안했을겁니다.
요새는 여자들끼리 하는가 유행인가,요새는 여자들끼리 하는 프로가 유행인가?
그냥 없어서 나는 중ㅋㅋ,그냥 어이가 없어서 웃음이 나는 중ㅋㅋ
##이 없어 보이,기운이 없어 보이던데
아르바이트할 때마다 꼭 화장실 가고더라. 병ㅋㅋ,아르바이트할 때마다 꼭 화장실 가고 싶더라.. 병인가ㅋㅋ
할머니 저 연세에 ㄷㄷ하네,할머니 저 연세에 영어공부 ㄷㄷ하네
친 사람이 먹어야 하는데 당한 사람도 참 깝하긴 하네,사기 친 사람이 욕 먹어야 하는데 당한 사람도 참 깝깝하긴 하네
너보다생김,너보다 잘생김
때려서 죽이네,와 때려서 사람을 죽이네요
늙어 죽어 죽든지만 참 그렇네...,늙어 죽든 젊어 죽든 죽는다지만 참 그렇네...
그냥 거지,그냥 그렇다는 거지.
에이니까 계속 거지. 그래도 휴가 있고 하니까 괜찮을 거야,에이 좋아하니까 계속 사귀시는 거지. 그래도 휴가 있고 하니까 괜찮을 거야
내일 당장 시험인데 아직 수업을 다 안들었어. 정신 나간거?,내일 당장 시험인데 아직 수업을 다 안들었어.. 나 정신 나간거 맞지?
##던 게 아니네 최초 탈락팀 되길,나만 그랬던 게 아니네 최초 탈락팀 되길 바람
##해서 해 악플러들아,말 좀 조심해서 해 악플러들아
,정말 일하기 싫다
노래방 물 괜찮은 [UNK] 도우미,[UNK] 노래방 가면 물 괜찮은 [UNK] 도우미 있다는데
어떻게 아무 것도 할아버지 할머니들?,어떻게 아무 것도 모르는 할아버지 할머니들 상대로 이래?
##도 여자보다 더,우리동네도 여자보다 남자들이 더 많아
내가 호 비용 쏠,내가 호캉스 비용 모두 쏠게
,얼른 결혼하고 싶어
일본은 마음에 들면 여자가면에 교환하자고.,일본은 마음에 들면 여자가 초면에 SNS 교환하자고 하더라.
조선족 어머니의 바람?,어느 조선족 어머니의 바람 봤어?
흑인들은 냄새가 나는,흑인들은 왜 냄새가 나는 거야?
그게 없는 ㅋㅋ,그게 무슨 매너 없는 소리야 ㅋㅋ
곧에서 갈 거니까 기대해라,곧 경찰서에서 연락 갈 거니까 기대해라.
아 때려 싶네,아…일 때려치고 싶네
##게 싫었노,아빠 정치하는게 그렇게 싫었노
