masked,original
쟤는 사람이 너무해서 문제라니까?,쟤는 사람이 너무 착해서 문제라니까?
짐승이 아니라 모른 척을 할 이유는,우린 짐승이 아니라 사람인데 모른 척을 할 이유는 없잖아
##야 같이차고놀자,친구야 같이공차고놀자
##를 해야 재미있. 그냥하면 무슨재미,돈내기를 해야 재미있지마.그냥하면 무슨재미
내가 골도 못게 해 주마!,오늘은 내가 한 골도 못 넣게 해 주마!
##끼 재미로하는건데해야지,친구끼라 재미로하는건데 살살해야지
맨날 말로만게찬다 공자,맨날 말로만 재미게찬다 공차자 말고
진짜 불태워 보시지,진짜 승부욕을 불태워 보시지.
이 오빠를 죽이고 대타를다...,[UNK]이 오빠를 죽이고 대타를 세웠다던데...
##라기 똑같이 생겼잖아.,대타라기엔 너무 똑같이 생겼잖아.
남자가 바빠서 피곤해서 못본 죄다 핑계,남자가 바빠서 피곤해서 못본다는거 죄다 핑계라던데
##은 돈많은 백수,내 꿈은 돈많은 백수야
부모님 몰래 아이돌 하려고 춤을 다녔? 그럼 학원비는 했지?,부모님 몰래 아이돌 하려고 춤 학원을 다녔다고? 그럼 학원비는 어떻게 했지?
##이 쟤는 부족한가봐,30만원이 쟤는 부족한가봐
[UNK]했네,[UNK] 컴백했네.
얜 키는 작달막 고양이상에머러스라 뿜뿜이야.,얜 키는 작달막해도 고양이상에 글래머러스라 매력 뿜뿜이야.
##도도 잘하고 ~,노래도 잘하고 영어도 잘하고~
근데 강박이 있는 듯 쪘빠 하는게 좀 안쓰러움.,근데 다이어트 강박이 있는 듯 쪘다빠졌다 하는게 좀 안쓰러움.
대구 사람들은 남녀노소 불문하고 걸,대구 사람들은 남녀노소 불문하고 좋아할 걸?
그 동네,그 동네 앞으로 와
왕따 적,왕따 시킨 적 없다.
저질 했냐 ㅋㅋㅋ,저질문 니가 했냐 ㅋㅋㅋ
##질 하는게 더,저런질문 하는게 더 이상함
우리 과장 회사에서깎고 매니어 까지름,우리 과장 회사에서 손톱깎고 매니큐어 까지 바름
왜 내가 보기엔 맛있게스럽,왜 내가 보기엔 맛있게 먹는거 복스럽던데
이 [UNK],이 사람 [UNK] 사람인가?
[UNK] 사람이 아니고 왜그래?,[UNK] 사람이 너한테 뭘 한것도 아니고 왜그래?
미국에서 남자들이 다 게 맞아,사실 미국에서 남자들이 다 내는 게 맞긴 맞아
##성이 풍부한다보다.,뭐 감수성이 풍부한다보다 생각하지.
##이 다 있는 거 아니겠어?,각자만의 감성이 다 있는 거 아니겠어?
##했으니 자연스러운 현상이지 뭐,요새 SNS 발달했으니 자연스러운 현상이지 뭐
여자로서 다시 여군에 지원을 했다면 삼지거야.,여자로서 다시 여군에 지원을 했다면 아무도 문제 삼지 않았을거야.
니 거.,니 가정폭력 옹호하는 거가.
요즘 저런 의사들 깔만 터졌네,요즘 저런 의사들 깔렸다고 하더니만 또 터졌네
아마 자기 혐오 능력이,아마 자기 혐오 능력이라고 생각해.
##둬떄리는거야 나.. 무서워..! 이러다가 다 죽어,악 그만둬 왜떄리는거야 나..무서워..! 이러다가 다 죽어
##는 먹어도 학대하진 않아,나는 돼지고기는 먹어도 동물을 학대하진 않아
##쉽하는 분위기 잡아,스킨쉽하는 분위기 어떻게 잡아?
##한테 일 시킨 지가 언젠데 아직도감무소다.,인턴한테 일 시킨 지가 언젠데 아직도 감감무소식이다.
전라도 지역 싫어,나는 전라도 지역을 싫어해
콕 찝어 전라도 사람들을 싫어하는 이유가 있어,콕 찝어 전라도 사람들을 싫어하는 이유가 있어?
아이돌이 아니라 아이돌 기부 거지,아이돌이 아니라 아이돌 회사가 기부한 거지.
,그런듯
강아지냐,강아지 왜 키우냐
##고 집에 때지가 않아,귀엽고 집에 있을 때 외롭지가 않아
오늘 칼하나,오늘 칼퇴하나?
##퇴 것 같아,아니 칼퇴 못할 것 같아
##같음을 거,나같음 싫을 거 같아
간호사는 환자를 막 대하,저 간호사는 환자를 막 대하네.
나이 서른 못하고 설거지도 못해,나 나이 서른인데 밥도 못하고 설거지도 못해
가난한 계속 가난하고부자,가난한 사람은 계속 가난하고 부자들은 갈수록부자
우리 특수부걸하네. 진검사!,우리 특수부에 온걸 환영하네.진검사!
.장님!,감사합니다.지검장님!!
네.장님 말씀대로.,네.지검장님 말씀대로 조심하겠습니다.
사람은 댓글알바,저 사람은 댓글알바인거 같아
여자를하고 혐오하지,왜 이렇게 여자를 억압하고 혐오하지
그러게 저렇게 대놓고 여성만을 억압하는 종교가,그러게 저렇게 대놓고 여성만을 억압하는 종교가 어딨어..
여직원은 여기서 일하기 위해서 열심히 노력했나 봐,그 여직원은 여기서 일하기 위해서 정말 열심히 노력했나 봐.
딸 같아서 쓰다듬 줬다,헉 딸 같아서 쓰다듬어 줬다니
정말 인격적으로 결함있게 살지야,나는 정말 인격적으로 결함있게 살지는 않을거야
둘째. 나랑 하자,둘째야. 나랑 얘기 좀 하자
애 없이할 거 같애,애 없이 얼마나 행복할 거 같애
##할 기분,농담할 기분 아니에요
다시. 너는 몰라도 배서방 같으니까,다시 생각해봐. 너는 몰라도 배서방 생각은 다른거 같으니까
남자 다 똑같다. 이건 봐,남자 마음 다 똑같다. 이건 아니라고 봐
배서방과 진지하게나봐 자꾸 집 밖으로 나돌지 않게,배서방과 진지하게 얘기나눠봐. 자꾸 집 밖으로 나돌지 않게
우리 저 솜탕자,우리 저 솜사탕 사먹자.
"아니, 그냥 졸.","아니, 그냥 너무 졸려서 그래."
남자 분명히 안어 봤을 듯,저 남자 분명히 여친 안 사귀어 봤을 듯
그니까 여자 중에 먹고 안는 여자 없던데,그니까 여자 중에 밥 먹고 화장실 안 들리는 여자 없던데
##이지냐?,그게 불륜이지 성범죄냐?
커뮤 수준 ; ;,요즘 커뮤 수준 무슨 일;;
사실 왕따,나 사실 학교에서 왕따당해
왜 땀 많으면 손를 없어서 좋은거아냐?,왜 손에 땀 많으면 손 마를일 없어서 좋은거아냐?
어쩌면 저렇게 사람해 할 골라서 하지?,어쩌면 저렇게 듣는 사람 민망해 할 얘기만 골라서 하지?
저게 일본에서 유명한 술인데 도저히 사람이대,저게 일본에서 유명한 술인데 도저히 사람이 마실 수가 없대
너 그거 장애인,너 그거 장애인 혐오야.
##지?,이거 귀엽지 않아?
확실히 동남아야 먹어볼래?,확실히 과일은 동남아야 먹어볼래?
나도 유럽 여러 번 가봤지만 저 인종은 한 번도 안 겪어 봄,나도 유럽 여러 번 가봤지만 저 정도로 심한 인종 차별은 한 번도 안 겪어 봄
부모 세대가 너무 꽉 문제긴 하지,부모 세대가 너무 부를 꽉 잡고 있는게 문제긴 하지
##도 아니고 걸쭉한 걸 어떻게 손으로 먹어?,"아니, 빵도 아니고 걸쭉한 걸 어떻게 손으로 먹어?"
어제 사촌동생 봤는데 그게 더 박진 넘침,어제 사촌동생 운동회 봤는데 그게 더 박진감 넘침
,제가 알아서 할게요
##들 이리 와봐라 줄게,내 손주들 이리 와봐라 용돈 줄게
##이 훨생겼지,우리나라 선수들이 훨 잘생겼지
전라도 광주,전라도 광주야.
몰카범이라고 무고한 몰아가는게 상식적인,몰카범이라고 무고한 사람 몰아가는게 상식적인 일인가?
사람이였으면 진짜했을 것 같다,내가 그 사람이였으면 진짜 억울했을 것 같다
##수 없겠다ㅜ,이 문제를 피할수 없겠다ㅜ
헐 너도 심해? 나도 엄청 심해 냄새만 맡으면 코가 확 막힌다니까,헐 너도 비염 심해? 나도 엄청 심해 ㅠ 담배 냄새만 맡으면 코가 확 막힌다니까
##생김ㅋㅋㅋ,얼마전에 여친생김ㅋㅋㅋ
다른 데는 어쩌라고 이런 얼척 있나,다른 데는 어쩌라고 이런 얼척없는 일이 있나.
아다,아 배고프다.
,그런말 하지마.
밖에 나가서도 하고도 해야지.,밖에 나가서 운동도 하고 취업준비도 해야지.
[UNK] 퇴물이 사람도,[UNK] 퇴물이라고 하는 사람도 있더라
##벵이 처럼 걸어가지?,왜 저렇게 굼벵이 처럼 걸어가지?
##도 안하고 나온다는거지,그만큼 연습도 안하고 나온다는거지.
##가 진짜 더리는 것 같애.,미디어가 진짜 사회를 더 망가뜨리는 것 같애.
얼굴 보고 가족부터 살찌면 후려치.,매일 얼굴 보고 사는 가족부터 살찌면 후려치잖아.
나도 남자가 여자를 때려,아무리 화가 나도 어떻게 남자가 여자를 때려
,너도 오랜만이다
요즘 좀 찐 같다,요즘 살 좀 찐 것 같다
##하니 확 찌,결혼하니 확 찌네
"##랑 좋아서했는데, 지금은네","아내랑 좋아서 결혼했는데, 지금은 별로네"
왜 사냐?,그럴거면 왜 같이 사냐?
쟤는 도대체 부족한,쟤는 도대체 부족한 게 뭐야
"노래, 연기, 작사, 인성까지 부족한 게","노래, 연기, 작사, 인성까지 뭐 하나 부족한 게 없어"
ㅈ 아편의점에서 일하는데 손님 적립했다가 본사에 걸려서 사장님한테 연락왔다,ㅈ됐다 아 나편의점에서 일하는데 손님 포인트 적립했다가 본사에 걸려서 사장님한테 연락왔다
,어우 나도 안해
참새웠나,참새 소리가 저렇게 시끄러웠나
##차게 짹짹대긴,아침부터 우렁차게 짹짹대긴 한다
제발 저런걸이니 작품이니 하지 말아줬으면,제발 저런걸 예술이니 작품이니 하지 말아줬으면..
##의이신듯..,혼자만의 착각이 심하신듯..
선배 밥 ~,선배님 밥 사주세용~
말이 안통하네.든 [UNK] 은야,말이 안통하네 .. 쨌든 [UNK]은 불법이야
니면 동네 상권은 다 없어져야,니 말대로면 동네 상권은 다 없어져야 되겠다?
##지?,여자들은 왜 그러는거지?
,여자들이 왜?
여자가 아닐.,모든 여자가 그런건 아닐꺼야.
중국으로 시집 오면적인 준,중국으로 시집 오면 파격적인 혜택을 준대
그럼 여자들도 중국으로 시집 가겠네,그럼 한국 여자들도 중국으로 많이 시집 가겠네?
우리 상사는 개인까지 설거지던데 ㅋㅋ,우리 상사는 개인 도시락통까지 설거지 시키던데 ㅋㅋ
##만줄 수 있어?,혹시 200만원만 빌려줄 수 있어?
중국인 안 태어나서 행복니당,중국인으로 안 태어나서 너무 행복합니당
,무엇을 먹게?
얘네 가족은 이름 족 인터넷에 다,얘네 가족은 이름 넣는 족족 인터넷에 다 나와
##도겠다,이번주도 복권 사야겠다
,당연히 알겠지.
,왜 부러워?
##고 정신병 있는 것 때문에될까봐 무섭다.,10대고 정신병력 있는 것 때문에 감형될까봐 무섭다.
그러니 낳아도 자식 고생하는 낳겠어.,그러니 낳아도 내 자식 고생하는데 왜 낳겠어.
뭐야? 너가 어떻게 이있어? 당장지!,뭐야?너가 어떻게 이 사진을 가지고있어?당장지워!
골었네ㅋ,[UNK] 골 넣었네 ㅋㅋㅋ
요즘 아이돌은 거의 벗고다시피,요즘 아이돌은 옷을 거의 벗고 나오다시피 하네
소변양도 어마어마 냄새 장난,소변양도 어마어마하고 냄새도 장난아니야
남자인지 여자인지도 흥분하지,남자인지 여자인지도 모르는데 너무 흥분하지 말고
남자들 중에 여사친서 자위하는?,남자들 중에 여사친 생각하면서 자위하는 사람 있어?
과장님 사모님가중,과장님 사모님 미모가 출중하십니다
##주는 직업은 하는 게 좋다고 들었음,기 나눠주는 직업은 안 하는 게 좋다고 들었음
거 쓰면 매국노,일본 거 쓰면 매국노냐?
[UNK] 장애 결국네,[UNK] 인터넷 장애 결국 원인이 밝혀졌네
"##도 아니고, 백주대낮에 저런","밤도 아니고, 백주대낮에 저런 실수를 하다니"
##똥집 먹고 싶다 ㅋㅋ 먹으로?,닭똥집 먹고 싶다 ㅋㅋ 먹으로 갈래?
##들 너무 많아,우리집앞에 고양이들 너무 많아
트젠 유튜브 성희롱하는 사람 많다,어제 트젠 유튜브 보는데 성희롱하는 사람 많다더라
,티비 다른거 보자
[UNK] 애들은 지들도 유색 인종이면서 왜하는지 모르겠다,[UNK]애들은 지들도 유색 인종이면서 왜 인종 차별하는지 모르겠다.
##했다고 그 돈 가지라고 할 듯.,보통 사람이면 고생했다고 그 돈 가지라고 할 듯.
"아무리 말을 안들었다지만, 나름 국방의 의무한다고 끌려온 저리 패","아무리 말을 안들었다지만, 나름 국방의 의무한다고 끌려온 애를 저리 패냐?"
말투 들어보니까 경상도,말투 들어보니까 경상도 사투리 나오더만
##된 백신으로명이나 접종대. 어이없다.,방치된 백신으로 140명이나 접종받았대. 어이없다.
집 나가려면 죽어라,집 나가려면 돈이나 죽어라 모아야겠어
조건이라도 해 경제적 제일해,조건이라도 해 경제적 자유가 제일 중요해
그래도 어린데 조건 심하네,그래도 아직 어린데 조건이라니 말이 심하네
저도 온정 했는데 반은 썩었음,저도 감자 온정매매 했는데 반은 썩었음.
,이게 말이 되냐
,아 그런거구나
맞아 소리도 개 보,맞아 소리도 개 크게 하고 보더라
##은 그렇다 치는데 체형까지버리네,아니 검열은 그렇다 치는데 체형까지 바꿔버리네
##세이 이제 코로나로 죽어나간다..,19세이하 애들도 이제 코로나로 죽어나간다..
##를하는지 지켜 봐야겠어,이번에 징계를 어찌하는지 지켜 봐야겠어
##를 했?,무슨 날조를 했길래?
곰팡이 냄새하는 획기적인가네?,곰팡이 냄새 제거하는 획기적인 세제가 나왔다네?
##가였어서 그런가?,워낙 각자가 톱스타였어서 그런가?
애도 없었고 둘이 더럽게 것도,애도 없었고 둘이 더럽게 헤어진 것도 아니라서.
선생이인지,누가 선생이고 아이들인지
왜 사는지 모르겠다니까,왜 저러고 사는지 모르겠다니까.
##든 먹히는 얼굴 아냐?,나 정도면 어디서든 먹히는 얼굴 아냐?
대기업다니고 능력도 있지 얼굴도 이하지 부족해,대기업다니고 능력도 있지 얼굴도 이 정도면 반반하지 뭐가 부족해
##하겠네,아이고 진짜 억울하겠네
##양이들 좀두면 안,길고양이들 좀 내버려두면 안 되나
알면 다음에도 꼭지 말해야,알면 다음에도 꼭 뭐 먹는지 말해야 돼
조수석에서 흔들다가 흘리는 행동 생각함,조수석에서 커피 흔들다가 흘리는 민폐 행동 어떻게 생각함
##들 버터크림이랑 생크림 다 구분,요즘 소비자들 버터크림이랑 생크림 다 구분한다
너 뭐야? [UNK] 이랑 생겼는데 [UNK] 아니지,너 노트북 뭐야? [UNK]이랑 비슷하게 생겼는데 [UNK]아니지?
엉 이랑 비슷하게 생겼는데 완전 저렴이. [UNK] 거기,엉 이거 [UNK]이랑 비슷하게 생겼는데 완전 저렴이.[UNK] 거기꺼야
금천구가 왜 나옴 롯데캐슬인 암,금천구가 왜 나옴 롯데캐슬 얼마인 줄 암?
##랑 한 번 몰아주지.만나러서. 애가 안됐어,애랑 한 번 몰아주지. 친구만나러 나가면서. 애가 안됐어
너도 사람이면서 말을 쓰니?,너도 한국 사람이면서 왜 그런 말을 쓰니?
##로 밤 일하나?,웬일로 밤늦게까지 일하나?
여기 담배 줄까? 버텨 뒤 이 나갈 수 있어,여기 담배 줄까? 버텨 1시간 뒤면 이 곳에서 나갈 수 있어
##을적으로 인간들도 있다더라,성희롱을 습관적으로 하는 인간들도 있다더라
너도 고딩빠 카드잖아,너도 고딩 때 엄빠 카드 썼잖아
##된?,어쩌다가 알게된 거야?
##이 차 뒤합니다.,예약이 차 일주일 뒤 방문합니다.
임산부 배려인데 여자는 지가 임산부도 아닌데 그런,임산부 배려석인데 여자는 지가 임산부도 아닌데 왜 그런 거야
파탄내고 여배우랑피 좋을까,가정 파탄내고 여배우랑 바람피우면 좋을까
누가 범죄자 말? 하지 말라고,누가 범죄자 욕하지 말래? 일반화 하지 말라고
너 엄마가 게임?,너 엄마가 게임 하지 말라고 했지?
우리 엄마가 돈 사람은 만나지 말랬거든.,우리 엄마가 나한테 돈 안 쓰는 사람은 만나지 말랬거든.
어머님이 딸을부러지게셨네.,어머님이 딸을 똑부러지게 잘 키우셨네.
남자들 때 계산적으로 구는 거 진짜 속 보여,남자들 연애할 때 계산적으로 구는 거 진짜 속 보여.
정신차려라 쓸데없는,정신차려라 그런 쓸데없는 소리하지말고
##들이랑 잘 맞더라고.,응 동료들이랑 잘 안 맞더라고.
너 이 폰 년지,너 이 폰 몇 년 썼지?
한... ㅋㅋ,한 6년 썼나...ㅋㅋ
자궁문신 스티커 남자한테 맞았,자궁문신 스티커 했는데 남자친구한테 맞았어
##까 병원에서 나오 여자봤냐,ㅋㅋ아까 병원에서 나오던 여자봤냐
##다고냐?,배고프다고 다 먹냐?
,그냥 손절하자
국회의원들이 메타,국회의원들이 메타버스 좋아해
잡초 제거하는 개발대,미국에서 잡초 제거하는 로봇 개발했대
뭐? 아니 너가 바람핀 하길 내가,뭐? 아니 너가 바람핀다고 하길래 내가 그런거지
"아 미안해, 근데 나는 니 여친 그렇게했지...","아 미안해, 근데 나는 니 여친 얘기만 듣고 그렇게 생각했지..."
##할.,지각할 거 같아요.
맞는 말만 했구만 갑자기질이야?,맞는 말만 했구만 갑자기 지적질이야?
,건강이 최고다
귀둥이는 뭐하고?,우리 귀염둥이는 뭐하고 있을까?
옆 사리 짓 했어?,옆 사리 사람이 뭐 이상한 짓 했어?
와 그건 좀..라도,와 그건 좀 그렇다.. 쪽지라도 쓰지
##려고 아무도 없어서 그냥 있었음..,사장님 부르려고 했는데 아무도 없어서 그냥 있었음..
##버지가 의붓딸 임신시켰,양아버지가 의붓딸을 임신시켰대
대통령 부산 맛보,대통령 후보가 부산 어묵 맛보노
##냐? ㅋㅋ 말하면 스트레스 잘 풀려,나만 재미있냐?ㅋㅋ 이렇게 말하면 스트레스 잘 풀려
야는 회사에서도 만들어서 하네 재밌겠다,야 쟤네는 회사에서 농구팀도 만들어서 하네 재밌겠다
##ㅋ 소리다 저게 얼마나 피곤한지 모르지?,ㅋㅋㅋ 니가 모르는 소리다 저게 얼마나 피곤한지 모르지?
연습 언제 하겠냐고 ㅋㅋ 주말에 할거 아니야 그러면 그냥의인거,연습 언제 하겠냐고 ㅋㅋ 주말에 할거 아니야 그러면 그냥 일의 연장인거임
저런 걸이라고 부를 수,저런 걸 어장이라고 부를 수 있나?
##는 것도 좀 만날 수도.,사귀는 것도 아닌데 좀 만날 수도 있지.
정치인의 품격ㅋㅋㅋ? 배우 품격 [UNK]더라,정치인의 품격ㅋㅋㅋ? 배우의 품격 [UNK] 대단한 연기더라
##병 걸렸냐?,너 무슨 연예인병 걸렸냐?
나도 한번자,나도 한번 입어보자.
작가가 또라도 했어?,왜 작가가 또 혐한 발언이라도 했어?
##력 진짜 안 좋...,골 결정력 진짜 안 좋던데...
칼 베,아 칼에 베였어
##이 엠날 아니야?,오늘이 엠티날 아니야?
목 콜라 싶다,아 목말라 콜라 마시고 싶다
목를 그냥 물야지,목 마를 땐 그냥 물 마셔야지
##면서 거지.,그냥 즐기면서 하자는 거지.
응 맞으러 마주쳤다고 애 맞지,응 백신 맞으러 갔다가 마주쳤다고 했던 애 맞지
응 걔 때 년 봤는데 그 이후로 모바일 청첩장 보냈더라,응 걔 그 때 몇 년 만에 봤는데 그 이후로 모바일 청첩장 보냈더라
때 [UNK] 많이 죽였다?,[UNK] 때 [UNK] 사람들 많이 죽였다며?
,그러게 말이다…
너 자살,너 자살카페 알아?
내 여친이 해서해보려고 했는데,내 여친이 페미라고 해서 이해해보려고 했는데
##찐 것,나 살찐 것 같아
솔직히 까놓고 말해서 [UNK]냐,솔직히 까놓고 말해서 [UNK] 말이 틀렸냐?
황희 입단 개고기송 울려퍼진 거냐,황희찬 입단식에 개고기송 울려퍼진 거 진짜냐
손가락 두껍지 않아...? 보여주기 부끄럽다,나 손가락 진짜 두껍지 않아...? 남한테 보여주기 부끄럽다
왜 두꺼진 거야? 원래부터? 아니면 네가 했어?,왜 두꺼워진 거야? 원래부터? 아니면 네가 뭐 잘못 했어?
손가락뼈 소리 많이 내서 그런 거..어졌,손가락뼈 소리 많이 내서 그런 거 같아.. 굵어졌어
[UNK] 후보들은 왜 지들 안 하고 을하냐?,[UNK] 후보들은 왜 지들 토론 안 하고 [UNK]을 공격하냐?
##할까봐 사람들 자꾸 댓글로 성희롱하네,인스타 그냥 탈퇴할까봐 사람들 자꾸 댓글로 성희롱하네
##틀하고던데,젠틀하고 괜찮던데 왜
##캐 됐어?? ㅋㅋㅋㅋㅋ,그 여자랑 어캐 됐어??ㅋㅋㅋㅋㅋ
##걸낰ㅋㅋㅋㅋㅋ,아 그럴걸 그랬낰ㅋㅋㅋㅋㅋ
그래도 대한민국에 돈 건 맞잖아.,그래도 대한민국에 돈 벌어다 준 건 맞잖아.
남자들은 그렇게 좋나친구 게임한다고 연락이 안 된다,남자들은 게임이 그렇게 좋나? 남자친구 게임한다고 연락이 안 된다
모텔은데이네,모텔 가고싶은데 방이없다네
치어리들은 돈나,치어리더들은 돈 많이 버나
그냥....져어.,그냥....난 안가져왔어.
##를 섭렵 하려나,모든종교를 섭렵 하려나 ?
니가 뭘 안다고. 넌 그냥 영상이나,니가 뭘 안다고..넌 그냥 한국 영상이나 봐
중국에 실제로 다리 많을 수도 있는거지,중국에 실제로 저렇게 다리 긴 사람들이 많을 수도 있는거지
지나가는 사람들 다 다리가지다가아지는건 어떻게할래?,지나가는 사람들 다 다리가 길어지다가 짧아지는건 어떻게 설명할래?
노노 장인 될,노노 이제 장인 될꺼임
뭐래린져 되는게 빠르겠다,뭐래 내가 첼린져 되는게 빠르겠다
니에서 끽거리는 소리 나는데?,니 의자에서 자꾸 끽끽거리는 소리 나는데?
동파리 대선후보 되면 [UNK] 찍는,동파리들은 [UNK] 대선후보 되면 [UNK] 찍는대
중국 중에는 좋은 걸 없어,중국 영화 중에는 좋은 걸 본적이 없어.
"아니 엄청까지는, 만한 것들은 있잖아.","아니 엄청 명작까지는 아니어도, 볼 만한 것들은 있잖아."
노인들에겐 정부에서 정신과을야 한다,노인들에겐 정부에서 정신과 상담을 지원해야 한다.
##처럼가서 공부하지 괜히 돈쓰고,그냥 나처럼 카페가서 공부하지 괜히 돈쓰고
아랫 너무서 잠을 못자겠는데하지?,아랫집에서 너무 떠들어서 잠을 못자겠는데 어떡하지?
##이해서 먹는 맛뿐만 아니라 보는 맛도 있는 게야,음식이 아기자기해서 먹는 맛뿐만 아니라 보는 맛도 있는 게 포인트야
1시간 댓글개 넘,1시간만에 댓글 600개 넘었네
흑인가 폭포에서 투신자살,흑인 소녀가 폭포에서 투신자살했대
ㅇㅇ 저녁에랑함,ㅇㅇ오늘 저녁에 친구들이랑 게임함
저번에 나랑했을 생각나더라고.,저번에 나랑 같이 게임했을 때가 생각나더라고.
오빠 좀줄 수 있어?,오빠 소화제 좀 사다줄 수 있어?
흙 사냐,나는 흙파먹고 사냐
,언제까지 줄거야
방금 너네 엄마,나 방금 너네 엄마 봤어
난 걍랑 조금 하고 있음 너도 하고?,난 걍 주식이랑 펀드 조금 하고 있음 너도 하고 있음?
아니 아빠 망해서 하지마 ㅋㅋ,아니 나는 아빠 하다가 망해서 하지마래 ㅋㅋ
가족 흙수저라 사람 니 밖에 없어서 타격감이 없어,우리 가족보고 흙수저라 하는 사람 니 밖에 없어서 타격감이 없어
복제인간이 너 일텐데 똑같이아닐까?,복제인간이면 또다른 너 일텐데 똑같이 생각하는거아닐까?
복제인간 만들어도 시스템 갖추겠지일은 없을꺼야,복제인간 만들어도 제어 시스템 갖추겠지 설마 그런일은 없을꺼야
떡정이,ㅋㅋ 무슨 떡정이야
왜구만,왜 보기 좋구만.
아 이 못하면서 엄청 떠들어대네,아 이 사람 알지도 못하면서 엄청 떠들어대네
##레가 제일 요란한 법이야,항상 빈수레가 제일 요란한 법이야
원래자보다가 제일 잘,원래 지시자보다 실무자가 제일 잘 알잖아
근데 못하면서질만 엄청 해,근데 잘 알지도 못하면서 지적질만 엄청 해
괜찮아애는 돈으로게 만들어 주면 되,괜찮아 우리애는 내가 돈으로 예쁘게 만들어 주면 되
그나저나는 좀 컸니?,그나저나 너희 아들 키는 좀 컸니?
,응 크고 있어
그리고 크게 하는 약,그리고 키 크게 하는 약 많이 나와
그것도 두푼이,그것도 한 두푼이 아니라던데
떼졌으면 좋겠다,떼법 좀 없어졌으면 좋겠다
안하면 남자인줄 그런거,안하면 남자인줄 알아서 그런거 아닐까?
,나 너무 힘들다
##해서 딱 죽,피곤해서 딱 죽겠어
##이 또 남한군 욕하고,북한군이 또 남한군 욕하고 있다던데
게 남한군을하냐,욕할 게 없어서 남한군을 욕하냐
##었나보네,너는 다른 사람이었나보네
헐 ㅋㅋㅋ 그렇게 생각있는 직업이라 ㅋㅋ,헐 ㅋㅋㅋ 난 그렇게 생각 안하는데 인기있는 직업이라 ㅋㅋ
##하고?,게임하고 있는데 왜?
