masked,original
##단다고 하지 그럼 뭐라고 해?,재밌단 걸 재밌다고 하지 그럼 뭐라고 해?
저 노출 즐긴다니까,저 연예인 노출을 즐긴다니까?
그게 무슨? 미쳤어?,야 그게 무슨 소리야? 미쳤어?
그만큼 거지.,그만큼 매력적이라는 거지.
수영하는 건지 까고 나오,수영하는 건지 웃통 까고 나오더라
개망...,주식 개망했다...
아니 전혀 안운데? 그렇게 거지?,아니 전혀 안 부러운데? 왜 그렇게 생각하는 거지?
교장 끝나면 우리 매점가자,교장 선생님 인사말 끝나면 우리 매점가자.
쫄 마 키 안 커.,야 자꾸 쫄지 마 키 안 커.
저이라고,저 아이가 초등생이라고?
아다고이지,아 뭐했다고 10월이지
야 서울역 앞에 거지들,야 서울역 앞에 거지들 엄청 많아.
정신병원에 강제입원 당한 멀쩡한 사람이 모르지,정신병원에 강제입원 당한 멀쩡한 사람이 얼마나 많은지 모르지?
너도 정상은 아닌 그거 성희롱,너도 정상은 아닌 것 같다 그거 성희롱이야
뚱뚱한 너한테? ; ;,내가 뚱뚱한 게 너한테 문제야?;;
##의 상대 만났나ㅋㅋ,운명의 상대는 못 만났나ㅋㅋ
여자들빨린다.,여자들 수다에 기빨린다.
",서 피 날거.","아, 귀에서 피 날거 같아."
공공장소 목소리 생각이 전혀 없네,공공장소에서 목소리 줄일 생각이 전혀 없네.
", 아줌마 남편 나쁜 사람이니 그만 좀","그래요, 아줌마 남편 나쁜 사람이니 그만 좀 하세요."
요즘이 왜 발 했는지 남자 이해가 된다,요즘 페미니즘이 왜 발흥 했는지 남자 입장에서 이해가 된다
헐 삼촌나 보네 세돈 개꿀딱,헐 나 삼촌 생기나 보네 세뱃돈 개꿀딱
10대가 60대 할머니빵 시키,10대가 60대 할머니 담배빵을 시키다니
게인데,나 게인데 질문 받는다
군대에서 이제 마스크 안 쓰는 집단 실험,군대에서 이제 마스크 안 쓰는 집단 실험한다고 하던데
연예인들은 겉으로만 척 하는,연예인들은 겉으로만 친한 척 하는 것 같아
##야 하니 어쩔 수 없는 관계겠지,같이 일해야 하니 어쩔 수 없는 친목 관계겠지
하긴 저렇게 큰데 저런쯤은 감수하겠지,하긴 저렇게 큰 돈 버는데 저런 것쯤은 감수하겠지
불매를 왜 햬? 터졌어?,불매를 왜 햬? 무슨 논란 터졌어?
아 자기 전에 사랑 안 해줬 다음날 저녁까지 안 받는 게 말이 되냐,아 자기 전에 사랑한다고 안 해줬다고 다음날 저녁까지 연락 안 받는 게 말이 되냐
,맞습니다
여자나이 40 하면 딱 떠오르는 생각은,여자나이 40이라고 하면 딱 떠오르는 생각은 뭐냐?
이슬람은의야,이슬람은 평화의 종교야
##서?,나한테서?
[UNK] 때문에 자기 목줄 채우게,[UNK] 때문에 자기 개 목줄 채우게 되었다고?
##들 죄다 가짜야!,요즘 뉴스들 죄다 가짜 뉴스야!
노력은하지 말도 모르냐?,노력은 배신하지 않는다는 말도 모르냐?
"배신하지 않지, 하지만 유전자는 배신","노력은 배신하지 않지, 하지만 유전자는 배신해."
외할머니가 적폐용고. 참.,외할머니가 적폐용어라고 하네.. 참.
##인 애들이라 세상 여자들 다 저런줄 아는거니 냅둬,온라인 세상이 전부인 애들이라 세상 여자들 다 저런줄 아는거니 냅둬
##집 데려갔다가 깨작거려서 돈아깝다 썰이 기사로 뜨네.,여친 참치집 데려갔다가 깨작거려서 돈아깝다는 썰이 기사로 뜨네.
그래야 시간낭비를 좀 하지,맞아 그래야 시간낭비를 좀 안 하지.
갈 발에 걸려서 방해되는 돌?,길 갈 때 발에 걸려서 방해되는 돌 있지?
야 30대이면 아가씨,야 요즘 30대 중반이면 아가씨야
연예인이 스태프한테 갑질,그 연예인이 스태프한테 갑질했다며?
##지,진짜 의외지
[UNK] 들 보면 진짜 주는게,[UNK] 들 보면 진짜 도움 주는게 뭐가있을까
맨날다고 말만 하지 안 쏴서 일 없지?,맨날 쏜다고 말만 하지 안 쏴서 신경쓸 일 없지 않냐?
##하고 싶다,회식하고 싶다
태국인이 태국 티 나는 게 문제임,태국인이 태국인 티 나는 게 뭐 문제임?
그런데 가서 쓰레기 놀고 왔으면 좋겠어,그런데 가서 쓰레기 버리지 말고 깨끗하게 놀고 왔으면 좋겠어
쓰레기 공공에 말라는 초등학생도 아는 맞는 말이다,쓰레기 공공장소에 버리지 말라는 말은 초등학생도 아는 맞는 말이다
##겠네,안 만나야겠네
인성이 고아랑야,인성이 고아랑 무슨 상관이야
리베로 수준차이가 땅다,리베로 수준차이가 하늘과 땅 차이다
ㅋㅋㅋㅋㅋ 아버지 크 하지,ㅋㅋㅋㅋㅋ 아버지 힘이 크긴 하지
시골은 진짜 사람 안되는,시골은 진짜 사람 살 곳이 안되는듯
,어디에서 봐?
몰카 야동 있는 나도 줘 다 막혔어,몰카 야동 있는 사이트 주소 나도 알려 줘 다 막혔어
엉? ㅋㅋ 그냥 싼 거 여러 개 게 ㅋ ㅋ,엉? ㅋㅋ 난 그냥 싼 거 여러 개 사는 게 좋은데 ㅋ ㅋ
##포츠를 그런 용도로...,ㅋㅋ스포츠를 그런 용도로 보냐...
한 깨진,한 200만원 깨진듯
마약국도 옛말이,우리나라 마약청정국도 옛말이네
##은 여자를 도구로 취급한다는,그말은 여자를 도구로 취급한다는 말이야?
요양병원에서 목숨을 이어가는을 보니까 불쌍.,요양병원에서 목숨을 이어가는 노인들을 보니까 너무 불쌍하더라.
과대 너무 여자만 같아,과대 너무 여자만 잘해주는 거 같아
니가 나 면 줬 부끄러웠다고,니가 나 면박 줬잖아 얼마나 부끄러웠다고
받아? 노래기 수준임 ㅋㅋㅋㅋ,받아쓰기? 이건 노래 맞추기 수준임 ㅋㅋㅋㅋ
ㅇㅈ 대체 노래를 부르는지 내가 원자면 울,ㅇㅈ 대체 무슨 노래를 부르는지 내가 원곡자면 울었음
", [UNK]걸","아, [UNK]일걸?"
더 빨리어야 하는데 아쉽다,조금 더 빨리 왔어야 하는데 아쉽다.
유기견소에서 주인을 못 만난 개들은 안락사.,유기견 보호소에서 주인을 못 만난 개들은 안락사된대.
청테이프만큼 강한 생각함,청테이프만큼 강한 테이프는 없다고 생각함
##서 머리가 안돌아 가는거,배고파서 머리가 잘 안돌아 가는거 같아
야집 한다며?,야 너희집 편의점 한다며?
니 지각아님? 택시 타고 가셈 혼날,니 지각아님? 택시 타고 가셈 늦으면 혼날껄
가 [UNK] 삼고 싶다 했다며,[UNK]가 [UNK] 며느리 삼고 싶다 했다며?
아였어..? 그럼 [UNK] 가 좋을 것 같아 힘 쓰는거 잘하거든,아 그런거였어..? 나는 그럼 [UNK]가 좋을 것 같아 나 힘 쓰는거 잘하거든
식당 아줌마들 건했는데...,식당 아줌마들한테 저러는 건 너무했는데...
[UNK] 은 지금 [UNK] 제발 맞아 빌어도 사람들 안 맞는다?,[UNK]은 지금 [UNK] 백신 제발 맞아 달라고 빌어도 사람들 안 맞는다던데?
##이 좀한 듯 ㅋㅋㅋ,너 취향이 좀 독특한 듯 ㅋㅋㅋ
어제 길거리를 걷다가 게이을 봤.,어제 길거리를 걷다가 우연히 게이 커플을 봤어.
"야, 성소수자가 음지에 숨어 살아야","야, 성소수자가 왜 음지에 숨어 살아야 하냐?"
##자들도 있으니까 당당하게 되지.,성소수자들도 인권이 있으니까 당당하게 살아도 되지.
성소수자에 차별과 혐오야 해.,성소수자에 대한 차별과 혐오는 멈춰야 해.
솔직히 남자는 확실히 북유럽 서유럽거...,솔직히 남자는 확실히 북유럽 서유럽쪽이 잘생긴거 같고...
여자는 한국 일본거...,여자는 한국 일본여자가 예쁜거 같음...
아니 상식적으로 경찰 대는게 말이노,아니 상식적으로 경찰한테 손을 대는게 말이 되노
막하고해서.,막 퇴근하고 피곤해서 그렇지.
또 못서 취조??,또 날 못 믿어서 취조하는거야??
넌욕이 넘쳐서 탈,넌 승부욕이 너무 넘쳐서 탈이야
그니까 코로나 걸려도져줄서ㅋㅋㅋㅋ,그니까 코로나 걸려도 책임도 안져줄꺼면서ㅋㅋㅋㅋ
뒤치거리 정신차려 30이고 금방 40된다.,뒤치닥거리하다 정신차려보면 30이고 금방 40된다.
솔로가 나쁜,야 솔로가 나쁜 거냐?
[UNK] 실태,[UNK] 위생 실태 봤냐?
##도 사회 초년생으로할껄?,알바도 사회 초년생으로 치면 비슷할껄?
그러든 말든 난관대로 가르쳤을 뿐이.,그러든 말든 난 내 교육관대로 가르쳤을 뿐이예요.
##짓거 시말서 쓰라면 쓸,까짓거 시말서 쓰라면 쓸게요.
선배랑 먹기 했는데 늦..,선배랑 밥 먹기로 했는데 늦었어..
##인지 단게 엄청 땡.,탄수화물 중독인지 단게 엄청 땡기네.
[UNK] [UNK] 진짜 얼굴 짧 완전 오이인데,[UNK] [UNK] 진짜 얼굴 짧다 완전 부러움 나는 오이인데
##져 비율도 진짜 멀리서 봐도 연예인,마져 비율도 진짜 좋음 멀리서 봐도 연예인같음
아 완전 거짓말은 분교 분교인걸 말 안한,아 완전 거짓말은 아니고 분교인데 분교인걸 말 안한거래
너무 많이 찐 같아서,나 살이 너무 많이 찐 거 같아서
쟤 교복 말이야 왜 저렇게 반반질 윤이 나는,쟤 교복 말이야 왜 저렇게 반질반질 윤이 나는 거야?
##한 선배들 물려받아서 저게이 낡은 거라서 그래.,졸업한 선배들 교복 물려받아서 저게 옷이 낡은 거라서 그래.
저 인간 유리창을 치고,저 인간 왜 유리창을 치고 난리야!
경찰 그냥버려야,경찰 불러서 그냥 보내버려야 돼
정수기야,정수기 왜 쓰는거야?
그냥 끓여서 보리 되는거 아님?,그냥 수돗물 끓여서 보리차 넣으면 되는거 아님?
진짜하게기야,진짜 치사하게 이러기야?
##디스 학원으로 등록 거?,스튜어디스 학원으로 등록한 거 맞지?
ㅇㅇ 다음에 합숙 잡아까 때 노리면 될 듯,ㅇㅇ 다음에 합숙 훈련 잡아놨으니까 그 때 노리면 될 듯
[UNK] 애들 나라 한국 마려웠나봐?,[UNK] 애들 자기 나라 선거에 한국 반응 마려웠나봐?
남자한테 육아휴직 쓰라 그러면 쌍.,남자한테 육아휴직 쓰라 그러면 쌍수들고 환영합니다.
##야지ㅋ,난 저러지말아야지ㅋ
너는 남자를 주니!!,너는 그런 남자를 소개시켜 주니!!
뚱뚱한 게,뚱뚱한 게 잘못이냐?
연예인들 많이 한번 해볼까?? 되게되고 예쁘던데,연예인들 숏컷 많이 하던데 한번 해볼까??되게 세련되고 예쁘던데
니가얼굴??,니가 내얼굴 본적있어??
##거래먹겠따,중고거래 진짜 못해먹겠따
##도 곧겠네,이제 공중파도 곧 망하겠네
니가 게,니가 잘하는 게 얼마나 많은데
언니들이랑 해야겠다,언니들이랑 놀러가자고 해야겠다
"대구에서, 자가면,게 사는 거냐","대구에서, 6억 자가면, 괜찮게 사는 거냐?"
"니두, 거.","니두 잘 알잖아, 아닌 거."
,그만 좀 먹어
지금 오지는 상태로 햄버거 해장하러 옆에 중딩 커플들,지금 숙취 오지는 상태로 햄버거 해장하러 왔는데 옆에 중딩 커플들 있어
좌파게들 움직이네.,좌파 언론사들 바쁘게들 움직이네.
대기업 없애는 목표,대기업 없애는 게 목표야?
동네 가게 수준,동네 가게 위생 수준 ㄷㄷ
##하기도 힘들,머리 관리하기도 힘들더라
##딱서니 없이 성인 되자마자 대출 받아서 중고차 애들하냐.,철딱서니 없이 성인 되자마자 대출 받아서 중고차 사는 애들 어떡하냐.
남자는 시끄러 현행범이냐,남자는 시끄러웠다고 현행범이 된거냐
##선 소매치기해,외국에선 핸드폰 소매치기 조심해
똥이와,근데 똥이 안나와ㅠㅠ
##가 돌 때기 잡았다,조카가 돌잡이 때 청진기 잡았다
때서 욕하는 니가 더게 보인다,이럴 때 틈타서 욕하는 니가 더 차갑게 보인다
##게 분명,시선 즐기는게 분명함
군대들은 다이 안되냐고?,왜 군대 에이스들은 다 진급이 안되냐고?
혹시 외모 열등감애들,혹시 외모 열등감 심한애들 있어?
솔직히 돈 거 맞는데 그렇게 하니.,솔직히 돈 아까운 거 맞는데 그렇게 말해야 하니..
##하게 태어난 사람들은 다해서 눈에어.,부유하게 태어난 사람들은 다 착해서 눈에 띄어.
가난한 사람들은 다 못됐,그럼 가난한 사람들은 다 못됐니?
어제 여혐 일어났다,어제 여혐 범죄 또 일어났다더라고
으 피 만드냐,으 무슨 피클씩이나 만드냐
아이돌들 거 솔직히 좀 싫어,아이돌들 연애하는 거 솔직히 좀 싫어
기부한 것도 자기 이미지킹 하려는,기부한 것도 자기 이미지 메이킹 하려는 것 같아
어른 없애야지,내가 어른 되면 제사 없애야지
어제 식당에서 밥먹고 있는데 어떤가 자기 지금 잔반 주는 거냐 막 행패부리,어제 식당에서 밥먹고 있는데 어떤 할아버지가 자기 지금 잔반 주는 거냐고 막 행패부리더라
쟤는 진짜 늘질,쟤는 진짜 연기가 늘질 않네
그래도잖아. 이쁘고! 먹고 나면 은근름,그래도 맛있잖아. 이쁘고!! 먹고 나면 은근 배부름
인도에 가 진짜 기상천한들 많다,인도에 가봤는데 진짜 기상천외한 일들 많다
중국도 문화가 개는 나라,의외로 중국도 문화가 개쩌는 나라임
의외로가 아니라 중국은 원래 문화가톱아님,의외로가 아니라 중국은 원래 문화가 아시아 원톱아님?
의외가 아니라 대놓고지 과거에 쟤네 잘 놈들이 얼마되지도 않는데,의외가 아니라 대놓고지 과거에 쟤네보다 잘 나갔던 놈들이 얼마되지도 않는데
고시생... 데이트 비용이되네,고시생인데... 데이트 비용이 부담되네
진짜 개 것들은 볼 때마다 화가 난다,진짜 개 유기하는 것들은 볼 때마다 화가 난다.
##씩 하는데 어떻게 살아,집값이 10억씩 하는데 어떻게 살아
너 쉬메라고,너 쉬메일이라고 알아?
너 자세 똑바로 앉아! 그러다 허리 다진다,너 자세 똑바로 앉아! 그러다 허리 다 망가진다
ㅎㅎㅎ 정자세로 있기,ㅎㅎㅎ 정자세로 있기가 너무 힘들어
할머니치기하시면,할머니 새치기하시면 어떻게해요
"법무부에서 여권 압수해서 시키, 또은 안하네","법무부에서 여권 압수해서 입국 시키더니, 또 구속은 안하네"
##도 밟히는게 그러겠지,검찰에서도 뭔가 밟히는게 있으니 그러겠지
걸하니,힘든 걸 어떡하니.
##대지 말고 운동이나 해라,ㅋㅋ 핑계대지 말고 운동이나 해라
##고하면 배린다,굶고 운동하면 몸 배린다
하나같이 것들이,하나같이 믿을 것들이 없네
엄마가 보험금 노리고 아버지를 살해한게야,엄마가 보험금을 노리고 아버지를 살해한게 사실이야?
역삼 상체가 가장데,역삼각형 상체가 가장 멋있데
##해도 걸하냐....,따라해도 그런 걸 따라하냐....
역시! 대강국,역시 한국! 문화 대강국!
집안이진 같네,집안 살림이 많아진 거 같네
남친이 밖에서 넘쉽해 ㅠㅜ,남친이 요즘 밖에서 자꾸 넘 스킨쉽해 ㅠㅜ
"나는 그런게 넘 민망해서, 막 안에 넣...","나는 그런게 넘 민망해서, 막 옷 안에 손 넣구..."
걔에 아빠매,야 걔 10월에 아빠된다매
##도 찌는 내 마음을 니가 아냐?,물 마셔도 살 찌는 내 마음을 니가 아냐?
내 이런똥 돈 받고는 일 못한다,내 이런 쥐똥 만큼 돈 받고는 일 못한다
그래서 어떻게든 면피하려고 저에 목숨을 거는,그래서 어떻게든 면피하려고 저 접종률에 목숨을 거는 구나.
코로나로 도우 살자 욕할힘도 없음,코로나로 힘든데 서로 도우며 살자 욕할힘도 없음
인정 나도 정치권은 신경쓰면 더듬는대로 두자,인정 나도 정치권은 신경쓰면 더힘듬 그냥 흘러가는대로 두자
연예인 세상에서 제일 쓸데없는,연예인 걱정이 세상에서 제일 쓸데없는 거다.
##가 한쪽 잘려,엉덩이가 한쪽이 잘려있어
##하네,모르겠지만 좀 특이하네
얏호 일교 없당 ~,얏호 오늘 일교시 없당~
##교시지ㅎㅎ?,너는 오늘 1교시지ㅎㅎ?
##들이 우리나라를 광복 시켰다,진짜 선조들이 우리나라를 괜히 광복 시켰다
##께는 무조건,고객께는 무조건 친절해야한다
##장님 짱,이야 우리점장님 짱
야 [UNK] 도 어려운데 [UNK] 아직 안 들었지? 그거 지옥이 엄청 어려워,야 근데 [UNK]도 어려운데 [UNK] 아직 안 들었지? 그거 진짜 지옥이야 엄청 어려워
둘째 누나는 젝이었지,둘째 누나는 젝키 팬이었지
,어우 무서워라
,혈압오르네
##잖아 너도,맛있잖아 너도 먹어봐
일 열심히 하고 없는 제일 싫어,일 열심히 하고 성과 없는 게 제일 싫어.
여자 없는데 씌워줄까,저 여자 우산 없는데 씌워줄까?
코로나 때문에 난리인데 싸돌아다닌다고 정신,코로나 때문에 난리인데 다들 싸돌아다닌다고 정신 없네
##따라이 더 빨갛 탐스럽네.,오늘따라 입술이 더 빨갛고 탐스럽네.
저거 결국 저 팔 대신 전시차로,저거 결국 저 가격에 팔았음 대신 전시차로 줌
너는 친구 나불거려 뭐냐?,너는 친구한테 나불거려가 뭐냐?
##자고 했던거 거절 당했어,이번에 강아지 기르자고 했던거 거절 당했어
##이구만,엄청 미인이시구만
왜 밥을고 다니니,왜 밥을 굶고 다니니?
미국농 수준보다 한참 낮다,미국 대학농구 수준보다 한참 낮다던데
여자 뭐를 많이 넣은 거 아니야?,저 여자 얼굴에 뭐를 너무 많이 넣은 거 아니야?
애인 꼴랑 인턴 붙어놓고 쇼핑치...,내 애인 꼴랑 인턴 붙어놓고 쇼핑 100만원치 지름...
너무 거구 철도 안든 거,너무 어린 거 같구 철도 안든 거 같아
헐 어떡해? ㅠㅠㅠ 잘 줄 알았는데,헐 어떡해 괜찮아? ㅠㅠㅠ 잘 만나고 있는 줄 알았는데
니는 진짜 태어난거,니는 진짜 잘못 태어난거 같다
,내가 왜
태어난게 잘못이냐,그렇다고 내가 태어난게 잘못이냐?
저사람다가 내 떨궈서 박살,저사람 도망가다가 내폰 떨궈서 박살남
##치겠는데?,진짜 너무 빡치겠는데?
##꺼지,이게 내꺼지?
자격지심 살아 있을까,자격지심 가지고 내가 살아 갈수 있을까
##지,진짜 어쩌지 ㅜ
,왜?
옷 걸 해도 도와줄 맛이 안 나네,옷 사는 걸 도와주려고 해도 도와줄 맛이 안 나네
영국 가더니 날라다니네 ㅋㅋㅋ 잘 좋겠다,영국 리그 가더니 날라다니네 ㅋㅋㅋ 계속 잘 했으면 좋겠다
스토커로,스토커로 신고할거에요
"말 좀 가려서 해라, 너는 할머니 할아버지 평생아","말 좀 가려서 해라, 너는 할머니 할아버지 평생 계실거같아?"
배에서하는 재밌?,배에서 낚시하는 거 재밌어?
,배고프다
그니까 천운이네 이거 빌미로 걍 게 듯,그니까 천운이네 이거 빌미로 걍 탈퇴시키는 게 나을 듯
나 요즘 때 계속 더듬는다,나 요즘 말할 때 계속 말을 더듬는다?
니 여자친구가 너 보는앞에서 남자랑 잤,니 여자친구가 너 보는앞에서 다른 남자랑 잤다며?
##으러?,회먹으러 갈까?
회못 튀김이나 없나?,회못먹으면 옆에 튀김이나 이런거 없나?
코피노 진짜마련 시급하다고 생각함,코피노 문제 진짜 새로운 대책마련 시급하다고 생각함
기고만장. 넌 이제했을 뿐이야,기고만장 하지마. 넌 이제 시작했을 뿐이야.
##지?,나 혀 길지?
가는 곳마다 보면서 좌우로 찢,가는 곳마다 나를 보면서 눈을 좌우로 찢더라
자기 엄마보다 아저씨랑 결혼한?,자기 엄마보다 나이가 많은 아저씨랑 결혼한다고?
##할 듯ㅋㅋㅋ,나중에 후회할 듯ㅋㅋㅋ
물론 결혼전엔 끊을건데 담배피면 아기한테 안좋은건 남자도 마찬가지 아니야??여자 싸보이는데??,물론 결혼전엔 끊을건데 담배피면 아기한테 안좋은건 남자도 마찬가지 아니야?? 그리고 왜여자만 싸보이는데??
제발 세상에서 싶다,제발 차별없는 세상에서 살고 싶다
엉게 없어서지,엉 입을게 없어서 이번에 샀지
아 진짜 입을 없단 말이야 이상하게 입고 순,아 진짜 입을거 없단 말이야 이상하게 입고 나갈 순 없잖아
너는 평생 사고 칠거 같아,너는 평생 한번이라도 사고 안 칠거 같아?
너는 때 왜 그렇게 쩝쩝대,너는 밥 먹을 때 왜 그렇게 쩝쩝대?
와 근데 답장 온게 갑자기 빠지면 어떡하냐 내시더라니까?,와 근데 답장 온게 갑자기 빠지면 어떡하냐면서 막 화를 내시더라니까?
아니 무슨 함한,아니 사장님 무슨 그런 함한 말씀을
##는날에 밤 가는거?,비오는날에 밤 드라이브 가는거 어때?
드라이브? 갑자기 왠 드라이브야 비오는날 박혀서 누워있어야지,드라이브? 갑자기 왠 드라이브야 비오는날엔 집에 콕 박혀서 누워있어야지
자고 일어났 내 박살나있음하냐,자고 일어났는데 내 차 박살나있음 어케하냐
,아직 그정도는 아니라고
쟤는 생각으로 거지?,쟤는 도대체 무슨 생각으로 한 거지?
[UNK] 은 죄다 달고 태어나,[UNK]은 죄다 쌍꺼풀 달고 태어나는데?
엥 죄다 쌍꺼풀 달고 태어나 왜 최근수 비율은 [UNK] 이 더 거야..?,엥 죄다 쌍꺼풀 달고 태어나는데 왜 최근 쌍수 비율은 [UNK]이 더 높은 거야..?
##이라도 하고 다니면 될까?,제발 화장이라도 하고 다니면 안 될까?
##뻘...,나는 딸뻘인데...
계속 살아서 일본인 같이 생겼네,쟤는 계속 일본에 살아서 그런지 일본인 같이 생겼네
아니 일본에서 살았다고 사람처럼 생겼다고 건 너무잖아,아니 일본에서 살았다고 일본 사람처럼 생겼다고 그러는 건 너무 억지잖아
살지를 말던가,그러면 일본 가서 살지를 말던가
##야 할 여성들이 있으니 페미도 있는 게 아닐까?,사회에 해결해야 할 여성 문제들이 있으니 페미도 있는 게 아닐까?
##들이 하는 행동이야.,나는 걔네들이 하는 행동이 별로야.
아 남자 만들고 싶다 ~,아 나두 남자친구 만들고 싶다~
##끼리 왜를 하는 걸까? 같이 안 되나?,친구끼리 왜 견제를 하는 걸까? 같이 잘되면 안 되나?
엄마 아빠 이혼한거 말하고 다녀,우리 엄마 아빠 이혼한거 왜 말하고 다녀?
##타 개하겠다 ㅋㅋㅋ 그니까 걍 적당히 좋아해야 됨,ㅇㅈ 현타 개심하겠다 ㅋㅋㅋ 그니까 걍 적당히 좋아해야 됨
똑같이 4시에 칼,월급은 똑같이 나오는데 4시에 칼퇴근
동네에양이 아저씨다,동네에 길고양이 챙기는 아저씨 계신다
##셨던 분이네,열심히 사셨던 분이네.
##은 두밖에 없냐?,요즘 핸드폰은 두 종류밖에 없냐?
,뭔소리 하는거냐?
##들야?,심사위원들 말하는거야?
멍청한 안멍청 니가 어떻게 아냐,내가 멍청한지 안멍청한지 니가 어떻게 아냐
? 첫사진이 에프턴줄 알았어. 둘다뽀다 쪄도이,?첫사진이 에프턴줄 알았어.. 둘다예뽀다 쪄도이쁨
성매매 지원해주는 거?,성매매피해자 지원해주는 거 어떻게 생각해?
##에서 옆에 앉으면 냄새 나.,도서관에서 흡연자 옆에 앉으면 냄새 너무 나.
ㄹㅇ이야들은 내 가수 안 했으면 함,ㄹㅇ이야 걔들은 내 가수 안 좋아 했으면 함
##해서 그냥 집에,아니 피곤해서 그냥 집에 갈래
걔 같은 수업듣는,나 걔랑 같은 수업듣는데
##도 할거야 으휴,본인들도 속상하긴 할거야 으휴
100년 전 10대이랑 약해보이는 거 하고,100년 전 10대 열강이랑 비교하면 약해보이는 거 같기도 하고
이 기자바ㅋㅋㅋ,이 기자 기사 제목 봐바ㅋㅋㅋ
,얼른 준비하고 나와
,[UNK] 안됐다
##든 내야,뭘 입든 내 자유야
달아놓은 걸 보면 그 사람 수준이 보여,인터넷 댓글 달아놓은 걸 보면 그 사람 수준이 보여.
아르바이트할 때 아가씨 하면서 보면 진짜 별로지 않아,아르바이트할 때 아가씨 하면서 부르는 사람들 보면 진짜 별로지 않아?
문제는 그 자리를 외노자 차지,문제는 그 자리를 외노자들이 차지한데…
그 커플이 되게 무례 불쾌,그 커플이 되게 무례해서 불쾌했어.
아침 일찍 공원가면하는 분들다? 하고 싶다,아침 일찍 공원가면 체조하는 분들 계신다? 나도 하고 싶다
너 다져,너 그러다 몸 다 망가져
##하다가 [UNK] 걸린 거겠지,구글 검색하다가 [UNK] 게시물 걸린 거겠지
그 정도가 아니라 아예해서 글 것?,그 정도가 아니라 아예 가입해서 글 쓰는 것 같던데?
신현역에서 오토바이 깔,이번엔 신논현역에서 오토바이 깔렸다
아 ㄹㅇ 그새했나보네,아 ㄹㅇ? 그새 또 파업했나보네
,여보 죄송해요
,잘 부탁드립니다~
그래서 기업들은 아예 기계 시켜버리,그래서 요즘 기업들은 아예 기계화를 시켜버리더라
##에도 일진같은게,요즘에도 일진같은게 있나?
"나이 망가졌는데, [UNK] 한번볼까 고민 중","나 휴대폰이 망가졌는데, [UNK]에서 한번 사볼까 고민 중"
